session_id,program_hide,paper ID,contribution type,authors,organisations,title,Abstract,file,image
sat-1c,TRUE,poster21,Poster,"Chiranjeevi Ankaiah; Aziz Fellah
",Northwest Missouri State University,Precipitation Quest - Game,"""Precipitation Quest"" is an interactive educational game designed to enhance students' understanding of fundamental chemistry concepts, including chemical reactions, solubility, and compound formation, in both Chemistry I and Chemistry II. Developed using the Godot Engine, the game transforms complex scientific principles into an engaging and immersive learning experience. Players experiment with various chemical reactions to observe the formation of precipitates, reinforcing their understanding of solubility rules, reaction mechanisms, and the factors influencing precipitation.  
A key focus of the game is the environmental issue of lead contamination in water, providing a real-world application that promotes critical thinking and problem-solving. Through interactive simulations, students explore the chemistry behind water contamination, the formation of insoluble compounds, and potential solutions for remediation. The game’s design encourages inquiry-based learning, allowing players to test hypotheses, analyze outcomes, and develop a deeper appreciation for the practical implications of chemistry in environmental and industrial contexts.  
By integrating gamification into chemistry education, *Precipitation Quest* aims to bridge the gap between theoretical knowledge and real-world application. The game fosters engagement, enhances conceptual retention, and provides an innovative approach to learning chemistry in an interactive and meaningful way.",,
sat-1c,TRUE,poster22,Poster,Ravipati Venkatalahari; Aziz Fellah,Northwest Missouri State University,Redox : Protect the World,"""Redox: Protect the World"" is an innovative educational game designed to transform the teaching and learning of redox chemistry through interactive and immersive gameplay. By integrating gamification into the educational experience, the project bridges the gap between traditional classroom instruction and modern digital learning methods. The game provides students with a dynamic platform to explore the fundamental principles of redox reactions in an engaging and intuitive manner.
Through structured gameplay, players encounter progressively challenging scenarios that require them to apply their knowledge of oxidation-reduction processes. This interactive approach not only reinforces theoretical concepts but also enhances critical thinking skills and scientific reasoning. By fostering curiosity and active participation, Redox: Protect the World encourages a deeper understanding and appreciation of chemistry, making learning more accessible and enjoyable.
Designed to support both self-directed learning and classroom integration, the game serves as a versatile educational tool. Educators can utilize it to introduce, reinforce, or assess students’ comprehension of redox reactions, while its flexible structure allows learners to progress at their own pace. This project seeks to revolutionize chemistry education by merging entertainment with academic enrichment, inspiring a new generation of students to engage with science in an interactive and meaningful way.",,